species,url,image,size,url_l,url_s,specific,note,care,img_1,img_2,img_3
Saint_Bernard,https://www.pedigree.co.th/dog-breeds/saint-bernard,"https://www.pedigree.co.th/cdn-cgi/image/format=auto,q=90/sites/g/files/fnmzdf3521/files/2022-04/large_4a5a719e-1ed6-4b62-af67-5d8dfcf6b588.jpg",ใหญ่,https://www.pedigree.co.th/our-products/adult-large-dog-food,https://www.pedigree.co.th/our-products/puppy-large-dog-food,พี่หมายักษ์ใหญ่หน้าตาใจดีอย่าง “เซนต์เบอร์นาร์ด” เป็นสุนัขกู้ภัยชื่อดังจากประเทศสวิตเซอร์แลนด์ สุนัขพันธุ์นี้รักเจ้าของมาก เป็นสมาชิกครอบครัวที่ดี พวกเค้าทั้งอ่อนโยนและรักสงบ จึงเข้ากับเด็กน้อยได้เป็นอย่างดี แต่หากต้องการให้อยู่ร่วมกับเพื่อนมะหมาตัวอื่น อาจต้องแนะนำให้รู้จักกันอย่างถูกวิธีและคอยดูแลอย่างใกล้ชิด เมื่อคุ้นเคยกันดีแล้ว พวกเค้าก็จะผูกพันกันไปตลอดชีวิต แม้จะมีขนาดตัวใหญ่ แต่เราสามารถเลี้ยงสุนัขเซนต์เบอร์นาร์ดในอพาร์ทเมนท์ได้ เพียงแต่ต้องระวังเรื่องสภาพอากาศ เพราะพวกเค้าชอบอากาศหนาวเย็น และไม่สามารถทนต่ออากาศร้อนได้,เนื่องจากเป็นสุนัขพันธุ์ใหญ่ เซนต์เบอร์นาร์ดจึงมีแนวโน้มที่จะเกิดปัญหาสุขภาพต่าง ๆ ได้ง่าย เช่น ท้องอืด โรคหัวใจ โรคทางตา โรคข้อสะโพกและข้อศอกเสื่อม คุณอาจไม่สามารถตรวจสอบโรคหัวใจได้ตั้งแต่แรกที่เริ่มรับเลี้ยง แต่สามารถเช็กปัญหาอื่น ๆ อย่างปัญหากระดูกข้อเสื่อมได้,สิ่งสำคัญในการให้อาหารหมาพันธุ์เซนต์เบอร์นาร์ดคือการเลือกอาหารหมาคุณภาพดีและเชื่อถือได้เท่านั้น คุณอาจต้องปรึกษาสัตวแพทย์เพื่อขอคำแนะนำเกี่ยวกับการจัดตารางเวลาให้อาหารหมา เพื่อป้องกันไม่ให้น้องหมาของคุณมีอาการท้องอืดซึ่งอาจเป็นอันตรายถึงชีวิต นอกจากนี้คุณหมอยังช่วยแนะนำเกี่ยวกับคุณค่าทางโภชนาการที่เหมาะสมได้อีกด้วย พี่หมาตัวใหญ่เหล่านี้ไม่กระตือรือร้นมากนักและต้องการการออกกำลังกายในระดับปานกลางเท่านั้น พวกเค้าชอบออกไปเดินเล่นกับคุณทุกวัน ซึ่งเป็นกิจกรรมการออกกำลังกายที่เพียงพอแล้วสำหรับพวกเค้า,./Image_col/saint bernard/saint1.jpg,./Image_col/saint bernard/saint_grow.jpg,./Image_col/saint bernard/saint_pup.jpg
Siberian_husky,https://www.pedigree.co.th/dog-breeds/siberian-husky,"https://www.pedigree.co.th/cdn-cgi/image/format=auto,q=90/sites/g/files/fnmzdf3521/files/2022-04/large_3c2c3c1d-36f3-4802-8be1-23efc665588c.jpg",กลาง,https://www.pedigree.co.th/our-products/adult-medium-dog-food,https://www.pedigree.co.th/our-products/puppy-medium-dog-food,ไซบีเรียน ฮัสกี้เป็นสุนัขที่ตื่นตัว เข้ากับคนง่าย และมีนิสัยอ่อนโยน แม้มีขนาดและรูปร่างหน้าตาเช่นนี้ แต่สุนัขสายพันธุ์นี้ไม่ก้าวร้าวกับสุนัขตัวอื่น ๆ หรือคนเมื่อได้รับการฝึกและรู้จักการเข้าสังคมเป็นอย่างดี ความฉลาด ความนิ่ง และช่างประจบ ทำให้ไซบีเรียน ฮัสกี้เป็นเพื่อนคู่กายที่มีค่าและผู้ช่วยงานที่กระตือรือร้น,ปัญหาสุขภาพที่พบได้ในน้องหมาพันธุ์นี้คือ ปัญหาข้อสะโพกเสื่อมและโรคตา แม้ว่าโดยทั่วไปแล้วพวกเค้าจะมีสุขภาพดี แต่การตรวจสุขภาพและการไปพบสัตวแพทย์เป็นประจำยังคงเป็นสิ่งที่จำเป็น,ไซบีเรียน ฮัสกี้เต็มไปด้วยพลัง ทำให้ต้องการออกกำลังกายเป็นประจำ การเดินเล่นและทำกิจกรรมกลางแจ้งจะช่วยให้พวกเค้าได้ปลดปล่อยพลังงานอย่างเต็มที่ ข้อควรระวังคือเจ้าก้อนขนเหล่านี้อาจเล่นสนุกเกินจนวิ่งหนีหรือหลงทางได้ เจ้าของจึงควรใช้สายจูงเมื่อต้องออกนอกบ้านเสมอ หากปล่อยให้วิ่งเล่นในสวนของคุณ ก็ควรตรวจสอบให้แน่ใจว่ารั้วสูงมากพอและปิดประตูเรียบร้อยดีแล้ว,./Image_col/Siberian husky/husky.jpg,./Image_col/Siberian husky/husky_grow.jpg,./Image_col/Siberian husky/husky_pup.jpg
Boston_bull,https://www.pedigree.co.th/dog-breeds/boston-terrier,"https://www.pedigree.co.th/cdn-cgi/image/format=auto,q=90/sites/g/files/fnmzdf3521/files/2022-04/large_fe98f102-4e81-4b5d-9c73-3f8cbbe2e9ba.jpg",เล็ก,https://www.pedigree.co.th/our-products/adult-small-dog-food,https://www.pedigree.co.th/our-products/puppy-small-dog-food,"บอสตัน เทอร์เรียแสดงออกชัดเจนถึงความมุ่งมั่น ความแข็งแกร่ง ความชอบทำกิจกรรม นอกจากนั้นยังเคลื่อนไหวอย่างอิสระและสง่างาม บอสตัน เทอร์เรียเป็นสุนัขที่ตื่นตัวและใจดี เป็นมิตร เป็นที่รัก และเป็นที่จดจำอย่างง่ายดายจากขนสีดำ-ขาวอันโดดเด่นคล้ายสวม ""ทักซิโด""",สุนัขบอสตัน เทอร์เรียเป็นสุนัขที่แข็งแรงและมีสุขภาพดี แต่ก็มีแนวโน้มที่จะเป็นโรคลมแดด ผู้เลี้ยงจึงต้องระมัดระวังเป็นพิเศษในช่วงหน้าร้อน และด้วยลักษณะดวงตาของพวกเค้า ทำให้เสี่ยงต่ออาการตาแห้ง โรคต้อกระจก โรคเชอร์รี่อาย อีกทั้งมีโอกาสเกิดบาดแผลบริเวณกระจกตาได้ง่าย ส่วนปัญหาสุขภาพอื่น ๆ ที่อาจพบได้ จะมีโรคกระดูกสะบ้าเคลื่อนหลุด ภาวะกระดูกสันหลังโค้ง โรคลมชัก และโรคหูหนวกตั้งแต่กำเนิด,การออกกำลังกายของสุนัขบอสตัน เทอร์เรียแต่ละตัวแตกต่างกัน บางตัวแค่เดินเล่น 1 – 2 รอบต่อวันก็เพียงพอแล้ว แต่บางตัวต้องการเวลาเล่นเพิ่มมากขึ้นเพื่อปลดปล่อยพลังงาน จึงไม่แนะนำให้ปล่อยน้องหมาพันธุ์นี้ใช้เวลาเล่นตามลำพัง พวกเค้าบางตัวอาจนั่ง ๆ นอนๆ โดยไม่ทำอะไรเลย และมันอาจกระตุ้นให้เกิดพฤติกรรมที่ไม่เหมาะสมได้อีกด้วย ทางที่ดีควรชวนพวกเค้าเล่นเกมหรือกิจกรรมที่ต้องเคลื่อนไหวร่างกาย เช่น เล่นคาบของ,./Image_col/Boston_bull/boston.jpg,./Image_col/Boston_bull/boston1.jpg,./Image_col/Boston_bull/boston_pup.jpg
Pomeranian,https://www.pedigree.co.th/dog-breeds/pomeranian,"https://www.pedigree.co.th/cdn-cgi/image/format=auto,q=90/sites/g/files/fnmzdf3521/files/2022-04/large_25e5e55d-289e-48cf-8828-d57801810290.jpg",เล็ก,https://www.pedigree.co.th/our-products/adult-small-dog-food,https://www.pedigree.co.th/our-products/puppy-small-dog-food,มีพละกำลังมากกว่าขนาดตัว ปอมเมอเรเนียนอาจมีขนาดเล็กกว่าบรรพบุรุษที่เป็นสุนัขลากเลื่อน แต่ยังคงมีอุปนิสัยแบบเดิม กล้าหาญ วางโต ไม่กลัวใคร สุนัขเหล่านี้ยังมีความอยากรู้อยากเห็นไม่หยุดหย่อนกับทุกสิ่งรอบตัว ดังนั้น จึงเป็นสุนัขเฝ้าบ้านที่ยอดเยี่ยม ในทางกลับกัน ปอมเมอเรเนียนอาจเป็นสายพันธุ์ที่ชอบเห่า ดังนั้น หากคุณชอบความเงียบสงบ หรือมีเพื่อนบ้านที่มีความรู้สึกไว สายพันธุ์นี้อาจไม่เหมาะสำหรับคุณ,ปัญหาที่พบบ่อยสำหรับสายพันธุ์ปอมเมอเรเนียน คือภาวะที่เรียกว่า Patellar luxation ภาวะนี้ที่เรียกว่า 'ข้อเข่าติด' ในคนคือสภาวะที่กระดูกสะบ้าหัวเข่าในขาหลังเคลื่อนออกจากตำแหน่ง แม้โดยปกติแล้วกระดูกสะบ้าหัวเข่าจะเคลื่อนกลับเข้าตำแหน่งเองได้ แต่ทุกครั้งที่เกิดภาวะนี้จะทำให้เยื่อบุข้อต่อเสียหาย ทำให้เกิดการอักเสบและอาจเจ็บปวดมาก โดยมีอาการต่างๆ เช่น เดินกะเผลกหรือเดิน 'กระโดดข้าม' แบบแปลกๆ ขอแนะนำให้ตรวจกระดูกและกล้ามเนื้อปีละสองครั้งโดยเฉพาะ,ปอมเมอเรเนียนตัวเล็กมากจึงมีความต้องการการออกกำลังกายน้อยกว่าปกติ อย่างไรก็ตาม สุนัขเหล่านี้ยังต้องการเดินวันละครั้ง และที่ดีที่สุดคือวันละสองครั้ง เพื่อให้มีโอกาสยืดขาเล็กๆ และสูดอากาศนอกบ้าน เนื่องจากขนาดที่เล็กของปอมเมอเรเนียน ควรหลีกเลี่ยงสวนสาธารณะที่มีสุนัขหลายสายพันธุ์ เพราะปอมเมอเรเนียนอาจถูกสุนัขที่ตัวโตกว่าชนล้มโดยไม่ตั้งใจ และบางครั้งปอมเมอเรเนียนเองยังอาจไปท้าทายสัตว์ที่ตัวใหญ่กว่า,./Image_col/Pomeranian/pome1.jpg,./Image_col/Pomeranian/pome2.jpg,./Image_col/Pomeranian/pome_pup.jpg
pug,https://www.pedigree.co.th/dog-breeds/pug,"https://www.pedigree.co.th/cdn-cgi/image/format=auto,q=90/sites/g/files/fnmzdf3521/files/2022-04/large_d0214ff3-7c4a-4d27-9948-468b6e97b2cc.jpg",เล็ก,https://www.pedigree.co.th/our-products/adult-small-dog-food,https://www.pedigree.co.th/our-products/puppy-small-dog-food,ปั๊ก ดูเหมือน 'เบบี้ โยดา' ในชีวิตจริง สุนัขสายพันธุ์นี้เป็นที่ต้องการอย่างมาก โดยเฉพาะอย่างยิ่งสำหรับครอบครัว และขึ้นชื่อเรื่องใจเย็นและว่าง่าย เข้ากับเด็กๆ และสัตว์เลี้ยงตัวอื่นได้ดีหลังผ่านการฝึกแล้ว โดยเฉพาะอย่างยิ่งเนื่องจากปั๊กมีนิสัยขี้เล่นและยังเป็นสุนัขตัวน้อยที่ค่อนข้างฉลาดด้วย สุนัขเหล่านี้ยังมีข้อดีจากการเป็นสายพันธุ์ที่ต้องการการดูแลค่อนข้างต่ำ ขนสั้นเรียบลื่นทำให้ดูแลง่าย และต้องการการออกกำลังกายระดับปานกลางเท่านั้น ปั๊กยังเป็นสายพันธุ์ที่ค่อนข้างเงียบและดูเหมือนจะไม่ชอบเห่ามากนัก,สิ่งหนึ่งที่ควรทราบคือ ปัํกมีรูปร่างเตี้ยล่ำและมักจะชอบนั่งๆ นอนๆ อยู่กับที่ จึงอาจทำให้มีน้ำหนักเพิ่มได้ง่าย แต่ไม่ต้องกังวล ตราบใดที่มีการควบคุมอาหารอย่างเหมาะสม และออกกำลังกายเพียงพอ ไม่ใช่เรื่องยากที่จะดูแลให้ปั๊กของคุณมีสุขภาพดีที่สุด โปรดทราบว่า ปั๊กมีอายุขัยเฉลี่ย 12 ถึง 15 ปีซึ่งถือว่ามีอายุยืนยาวอีกด้วย,เนื่องจากเป็นสายพันธุ์ที่ไม่ชอบอะไรมากไปกว่าการได้นั่งแอบอิงเจ้าของบนโซฟา สุนัขเหล่านี้ยังชื่นชอบอาหารด้วย สิ่งสำคัญคือ ปั๊กควรออกกำลังกายทุกวัน ควรใช้เวลาออกกำลังกายไม่เกิน 1 ชั่วโมง ไม่ว่าจะโดยการเดินหรือไปสวนสาธารณะที่มีสุนัขหลายสายพันธุ์ และปั๊กสนุกกับการเล่นเกมในสวนเช่นกัน,./Image_col/pug/pug.jpg,./Image_col/pug/pug2.jpg,./Image_col/pug/pug3.jpg
standard_poodle,https://www.pedigree.co.th/dog-breeds/poodle,"https://www.pedigree.co.th/cdn-cgi/image/format=auto,q=90/sites/g/files/fnmzdf3521/files/2022-04/large_993c14fa-52e4-4491-a5cf-bfd85ea89508.jpg",เล็ก,https://www.pedigree.co.th/our-products/adult-small-dog-food,https://www.pedigree.co.th/our-products/puppy-small-dog-food,หากคุณต้องการเลี้ยงพุดเดิ้ล การทำความเข้าใจลักษณะเฉพาะตัวของพวกเค้าเป็นสิ่งสำคัญมาก โดยสุนัขพุดเดิ้ลมีความเฉลียวฉลาด คล่องแคล่ว สนุกสนาน และฝึกได้ง่าย วางใจได้เลยว่าพวกเค้าจะเข้ากับสมาชิกในครอบครัวได้เป็นอย่างดี ถึงแม้ว่าน้องหมาพันธุ์นี้จะเป็นมิตรกับเด็ก แต่กับสัตว์เลี้ยงชนิดอื่น อาจต้องฝึกเข้าสังคมให้พวกเค้าตั้งแต่เนิ่นๆ,สิ่งหนึ่งที่คุณจะได้จากการเลี้ยงพุดเดิ้ลคือเพื่อนที่ซื่อสัตย์ แต่อาจต้องให้ความสนใจเพื่อนตัวนี้กันมากหน่อย พวกเค้าอาจเห่าเมื่อรู้สึกว่าถูกละเลย และเช่นเดียวกับสุนัขพันธุ์อื่น ๆ พุดเดิ้ลก็พร้อมปกป้องคนที่รักอยู่เสมอ,พุดเดิ้ลทุกขนาดมีความแอคทีฟสูง พวกเค้าจำเป็นต้องออกกำลังกายเป็นประจำ อย่างน้อยวันละ 1 ชั่วโมง เพื่อป้องกันโรคอ้วนและปัญหาสุขภาพอื่น ๆ น้องหมาเหล่านี้ชื่นชอบการทำกิจกรรมทุกรูปแบบ ทั้งการเล่นคาบกิ่งไม้และการว่ายน้ำซึ่งเป็นกิจกรรมสุดโปรด,./Image_col/standard_poodle/poodle1.jpg,./Image_col/standard_poodle/poodle2.jpg,./Image_col/standard_poodle/poodle_pup.jpg
Maltese_dog,https://www.pedigree.co.th/dog-breeds/maltese,"https://www.pedigree.co.th/cdn-cgi/image/format=auto,q=90/sites/g/files/fnmzdf3521/files/2022-04/large_491f81c2-a286-4d2a-b736-b00d44ebde92.jpg",เล็ก,https://www.pedigree.co.th/our-products/adult-small-dog-food,https://www.pedigree.co.th/our-products/puppy-small-dog-food,แม้มีขนาดเล็ก แต่สัตว์ตัวน้อยที่กล้าหาญเหล่านี้ค่อนข้างมั่นใจและไม่หวั่นไหวง่าย อันที่จริง มอลทีสอาจดื้อรั้นบ้างในบางครั้งด้วยซ้ำ ดังนั้น คลาสการฝึกแต่เนิ่นๆ จะเป็นประโยชน์ในเรื่องนี้ มอลทีสฉลาดมาก เรียนรู้ได้อย่างรวดเร็ว นอกจากนั้นยังเป็นสุนัขเฝ้าบ้านที่ดี อย่างน้อยก็ในแง่การเห่า ไม่ใช่พฤติกรรมทางกายภาพ สิ่งที่ขาดหายไปในเรื่องขนาดสำหรับสุนัขเหล่านี้ได้รับการชดเชยด้วยทัศนคติ,เนื่องจากมีขนาดเล็ก จึงไม่แนะนำมอลทีสสำหรับบ้านที่มีเด็กวัยหัดเดินหรือเด็กที่เล็กมาก โดยเฉพาะอย่างยิ่ง เนื่องจากมอลทีสอาจช่างเห่าเล็กน้อยในบางครั้ง สุนัขเหล่านี้ยังไม่ชอบถูกทิ้งให้อยู่ตามลำพังเป็นเวลานาน จึงเหมาะที่สุดสำหรับผู้ที่อยู่ที่บ้านในระหว่างวันหรือพาสุนัขไปทำงานด้วย,เพื่อให้สุนัขยังคงมีสุขภาพดีและมีความสุข สุนัขควรมีการเดินเล่นในระยะสั้นๆ ทุกวันหรือทุกสองวัน นั่นก็เพียงพอแล้ว อย่างไรก็ตาม ควรมีกิจกรรมเสริมเป็นการเล่นและการเล่นเกมเป็นประจำ เนื่องจากมอลทีสเป็นสายพันธุ์ที่ฉลาดและต้องการการกระตุ้นสมอง กิจกรรมนี้จะช่วยเบี่ยงเบนความสนใจไม่ให้สุนัขเห่ามากเกินไป,./Image_col/Maltese_dog/maltese1.jpg,./Image_col/Maltese_dog/maltese2.jpg,./Image_col/Maltese_dog/maltese3.jpg
